{
  "spec_id": "delf_c1",
  "language": "fr",
  "exam_name": "DELF C1",
  "cefr": "C1",
  "derived": true,
  "verified_on": "2026-10-10",
  "source_url": "France Education international",
  "pass_ratio": 0.5,
  "scale_to": 25,
  "sections": [
    {
      "skill": "listening",
      "duration_min": 30,
      "parts": [
        {
          "part_no": 1,
          "task_type": "short_texts",
          "item_type": "mcq",
          "item_count": 6,
          "audio": {
            "segments": 1,
            "plays_per_segment": 2,
            "preview_seconds": 30,
            "speakers": 1,
            "kind": "dialogue"
          },
          "verify": true,
          "title": "Sample Title"
        },
        {
          "part_no": 2,
          "task_type": "short_texts",
          "item_type": "mcq",
          "item_count": 6,
          "audio": {
            "segments": 1,
            "plays_per_segment": 2,
            "preview_seconds": 30,
            "speakers": 1,
            "kind": "dialogue"
          },
          "verify": true,
          "title": "Sample Title"
        },
        {
          "part_no": 3,
          "task_type": "short_texts",
          "item_type": "mcq",
          "item_count": 6,
          "audio": {
            "segments": 1,
            "plays_per_segment": 2,
            "preview_seconds": 30,
            "speakers": 1,
            "kind": "dialogue"
          },
          "verify": true,
          "title": "Sample Title"
        }
      ],
      "order_fixed": false
    },
    {
      "skill": "reading",
      "duration_min": 60,
      "parts": [
        {
          "part_no": 1,
          "task_type": "generic_mcq",
          "item_type": "mcq",
          "item_count": 6,
          "verify": true,
          "title": "Sample Title"
        },
        {
          "part_no": 2,
          "task_type": "generic_mcq",
          "item_type": "mcq",
          "item_count": 6,
          "verify": true,
          "title": "Sample Title"
        }
      ],
      "order_fixed": false
    },
    {
      "skill": "writing",
      "duration_min": 60,
      "parts": [
        {
          "part_no": 1,
          "task_type": "writing",
          "item_type": "writing",
          "item_count": 1,
          "writing": {
            "min_words": 208,
            "max_words": 260,
            "register": "informal",
            "content_points": 3
          },
          "criteria": [
            {
              "name": "Task fulfilment",
              "max_points": 25
            }
          ],
          "verify": true,
          "title": "Sample Title"
        }
      ],
      "order_fixed": false
    },
    {
      "skill": "speaking",
      "duration_min": 20,
      "parts": [
        {
          "part_no": 1,
          "task_type": "speaking",
          "item_type": "speaking",
          "item_count": 1,
          "speaking": {
            "format": "examiner",
            "prep_seconds": 600,
            "speaking_seconds": 180
          },
          "criteria": [
            {
              "name": "Task fulfilment",
              "max_points": 8
            }
          ],
          "verify": true,
          "title": "Sample Title"
        },
        {
          "part_no": 2,
          "task_type": "speaking",
          "item_type": "speaking",
          "item_count": 1,
          "speaking": {
            "format": "examiner",
            "prep_seconds": 0,
            "speaking_seconds": 180
          },
          "criteria": [
            {
              "name": "Task fulfilment",
              "max_points": 8
            }
          ],
          "verify": true,
          "title": "Sample Title"
        },
        {
          "part_no": 3,
          "task_type": "speaking",
          "item_type": "speaking",
          "item_count": 1,
          "speaking": {
            "format": "examiner",
            "prep_seconds": 0,
            "speaking_seconds": 180
          },
          "criteria": [
            {
              "name": "Task fulfilment",
              "max_points": 8
            }
          ],
          "verify": true,
          "title": "Sample Title"
        }
      ],
      "order_fixed": false
    }
  ]
}